A1: CARIFTA WATERPOLO COMPETITION
A2: KINGSTON, JAMAICA
A5: FEMALE 18 & UNDER
A7: TEAMS | B7: W | C7: L | D7: D | E7: GF | F7: GA | G7: GD | H7: POINTS
A8: Curacao | B8: 1 | C8: 3 | E8: 25 | F8: 52 | G8: =E8-F8 -> -27 | H8: 2
A9: Jamaica | B9: 1 | C9: 3 | E9: 19 | F9: 52 | G9: =E9-F9 -> -33 | H9: 2
A10: Trinidad & Tobago | B10: 4 | E10: 71 | F10: 11 | G10: =E10-F10 -> 60 | H10: 8
A14: MALE 15 & UNDER
A16: TEAMS | B16: W | C16: L | D16: D | E16: GF | F16: GA | G16: GD | H16: POINTS
A17: Curacao | B17: 3 | C17: 1 | E17: 69 | F17: 26 | G17: =E17-F17 -> 43 | H17: 6
A18: Jamaica | C18: 4 | E18: 16 | F18: 94 | G18: =E18-F18 -> -78 | H18: 0
A19: Trinidad & Tobago | B19: 3 | C19: 1 | E19: 59 | F19: 24 | G19: =E19-F19 -> 35 | H19: 6
A22: MALE 18 & UNDER
A24: TEAMS | B24: W | C24: L | D24: D | E24: GF | F24: GA | G24: GD | H24: POINTS
A25: Bahamas | C25: 3 | E25: 5 | F25: 77 | G25: =E26-F26 -> -72 | H25: 0
A26: Curacao | B26: 2 | D26: 1 | E26: 55 | F26: 10 | G26: =E27-F27 -> 45 | H26: 5
A27: Jamaica | B27: 1 | C27: 2 | E27: 25 | F27: 31 | G27: =E28-F28 -> -6 | H27: 2
A28: Trinidad & Tobago | B28: 2 | D28: 1 | E28: 43 | F28: 10 | G28: =E29-F29 -> 33 | H28: 5
B31: W - Win | E31: GF - Goals For
B32: L - Lost | E32: GA - Goals Against
B33: D - Draw | E33: GD - Goal Difference