A1: JAMAICA INTERNATIONAL INVITATIONAL TOURNAMENT 2005 - POINTS SHEET
O2: Place
L3: Goal | M3: Goal | O3: for
A4: Team | B4: Trinidad | D4: Jam Junior | F4: Jam Senior | H4: International | J4: Bahamas | L4: for | M4: against | N4: Points | O4: Final
A5: Trinidad | D5: 17 | E5: 6 | F5: 17 | G5: 9 | H5: 13 | I5: 11 | J5: 22 | K5: 1 | L5: =B5+D5+F5+H5+J5 -> 69 | M5: =C5+E5+G5+I5+K5 -> 27 | N5: 8 | O5: 1
A6: Jam Junior | B6: 6 | C6: 17 | F6: 7 | G6: 5 | H6: 5 | I6: 0 | J6: 19 | K6: 9 | L6: =B6+D6+F6+H6+J6 -> 37 | M6: =C6+E6+G6+I6+K6 -> 31 | N6: 6 | O6: 2
A7: Jam Senior | B7: 9 | C7: 17 | D7: 5 | E7: 7 | H7: 11 | I7: 14 | J7: 23 | K7: 5 | L7: =B7+D7+F7+H7+J7 -> 48 | M7: =C7+E7+G7+I7+K7 -> 43 | N7: 2 | O7: 4
A8: International | B8: 11 | C8: 13 | D8: 0 | E8: 5 | F8: 14 | G8: 11 | J8: 31 | K8: 4 | L8: =B8+D8+F8+H8+J8 -> 56 | M8: =C8+E8+G8+I8+K8 -> 33 | N8: 4 | O8: 3
A9: Bahamas | B9: 1 | C9: 22 | D9: 9 | E9: 19 | F9: 5 | G9: 23 | H9: 4 | I9: 31 | L9: =B9+D9+F9+H9+J9 -> 19 | M9: =C9+E9+G9+I9+K9 -> 95 | N9: 0 | O9: 5