A2: INTERSECONDARY SCHOOL LEAGUE - POINT STANDINGS (UP TO OCT 29, 2005)
F4: Girls 87, 88 | L4: Goals | M4: Goal
A5: School | B5: Campion | D5: Immaculate | F5: St. Andrews | H5: H Childhood | L5: for | M5: against | N5: Points | O5: Place
A6: Campion | D6: 7 | E6: 3 | H6: 6 | I6: 9 | L6: =B6+D6+F6+H6 -> 13 | M6: =C6+E6+G6+I6 -> 12 | N6: 2 | O6: 2
A7: Immaculate | B7: 3 | C7: 7 | L7: =B7+D7+F7+H7 -> 3 | M7: =C7+E7+G7+I7 -> 7 | N7: 0 | O7: 3
A8: St. Andrews | L8: =B8+D8+F8+H8 -> 0 | M8: =C8+E8+G8+I8 -> 0 | O8: 4
A9: H Childhood | B9: 9 | C9: 6 | L9: =B9+D9+F9+H9 -> 9 | M9: =C9+E9+G9+I9 -> 6 | N9: 2 | O9: 1
F10: Girls 91, 92, 93, 94 | L10: Goals | M10: Goal
A11: School | B11: Campion | D11: Immaculate | F11: Wolmers | H11: H Childhood | L11: for | M11: against | N11: Points | O11: Place
A12: Campion | H12: 5 | I12: 10 | L12: =B12+D12+F12+H12 -> 5 | M12: =C12+E12+G12+I12 -> 10 | N12: 0 | O12: 2
A13: Immaculate | L13: =B13+D13+F13+H13 -> 0 | M13: =C13+E13+G13+I13 -> 0 | O13: 3-4
A14: Wolmers | L14: =B14+D14+F14+H14 -> 0 | M14: =C14+E14+G14+I14 -> 0 | O14: 3-4
A15: H Childhood | B15: 10 | C15: 5 | L15: =B15+D15+F15+H15 -> 10 | M15: =C15+E15+G15+I15 -> 5 | N15: 2 | O15: 1
G16: Girls 89, 90 | L16: Goals | M16: Goal
A17: School | B17: H Childhood | D17: Wolmers | L17: for | M17: against | N17: Points | O17: Place
A18: H Childhood | D18: 11 | E18: 3 | L18: =D18+D19 -> 11 | M18: =E18+E19 -> 3 | N18: 2 | O18: 1
A19: H Childhood
A20: Wolmers | B20: 3 | C20: 11 | L20: =B20+B21 -> 3 | M20: =C20+C21 -> 11 | N20: 0 | O20: 2
A21: Wolmers
F22: Boys 87, 88, 89, 90 | L22: Goals | M22: Goal
A23: School | B23: Wolmers | D23: St. Georges | F23: Hillel | H23: Campion | J23: Ardenne | L23: for | M23: against | N23: Points | O23: Place
A24: Wolmers | H24: 10 | I24: 7 | J24: 22 | K24: 3 | L24: =B24+D24+F24+H24+J24 -> 32 | M24: =C24+E24+G24+I24+K24 -> 10 | N24: 4 | O24: 1
A25: St. George's | L25: =B25+D25+F25+H25+J25 -> 0 | M25: =C25+E25+G25+I25+K25 -> 0 | O25: 5
A26: Hillel | J26: 3 | K26: 20 | L26: =B26+D26+F26+H26+J26 -> 3 | M26: =C26+E26+G26+I26+K26 -> 20 | N26: 0 | O26: 4
A27: Campion | B27: 7 | C27: 10 | L27: =B27+D27+F27+H27+J27 -> 7 | M27: =C27+E27+G27+I27+K27 -> 10 | N27: 0 | O27: 3
A28: Ardenne | B28: 3 | C28: 22 | F28: 20 | G28: 3 | L28: =B28+D28+F28+H28+J28 -> 23 | M28: =C28+E28+G28+I28+K28 -> 25 | N28: 2 | O28: 2
F29: Boys 91, 92, 93, 94 | L29: Goals | M29: Goal
A30: School | B30: Wolmers | D30: St. Georges | F30: Hillel | H30: Campion | J30: Ardenne | L30: for | M30: against | N30: Points | O30: Place
A31: Wolmers | F31: 19 | G31: 0 | L31: =B31+D31+F31+H31+J31 -> 19 | M31: =C31+E31+G31+I31+K31 -> 0 | N31: 2 | O31: 2
A32: St. George's | F32: 23 | G32: 0 | H32: 13 | I32: 1 | L32: =B32+D32+F32+H32+J32 -> 36 | M32: =C32+E32+G32+I32+K32 -> 1 | N32: 4 | O32: 1
A33: Hillel | B33: 0 | C33: 19 | D33: 0 | E33: 23 | L33: =B33+D33+F33+H33+J33 -> 0 | M33: =C33+E33+G33+I33+K33 -> 42 | N33: 0 | O33: 5
A34: Campion | D34: 1 | E34: 13 | J34: 10 | K34: 12 | L34: =B34+D34+F34+H34+J34 -> 11 | M34: =C34+E34+G34+I34+K34 -> 25 | N34: 0 | O34: 4
A35: Ardenne | H35: 12 | I35: 10 | L35: =B35+D35+F35+H35+J35 -> 12 | M35: =C35+E35+G35+I35+K35 -> 10 | N35: 2 | O35: 3