D1: CISC 2008 Kingston, Jamaica Final Result Synchronized Swimming
D2: FIGURES
D3: 13-15
A5: Place | D5: Swimmer
A6: 1 | C6: CUB | D6: Grisel Tendero | E6: 69.382999999999996
A7: 2 | C7: ARU | D7: Kristen Eman | E7: 66.382999999999996
A8: 3 | C8: DOM | D8: Camille Cruz | E8: 65.477999999999994
A9: 4 | C9: ARU | D9: Kiara Van Trikit | E9: 65.283000000000001
A10: 5 | C10: ARU | D10: Roxanne Pietersz | E10: 65.022999999999996
A11: 6 | C11: DOM | D11: Scarlet Hernandez | E11: 64.759
A12: 7 | C12: DOM | D12: Andrea Ortega | E12: 64.168999999999997
A13: 8 | C13: ARU | D13: Caroline Waldron | E13: 63.020
A14: 9 | C14: DOM | D14: Amalia Julia | E14: 63.023000000000003
A15: 10 | C15: DOM | D15: Ma Fernanda Ferreras | E15: 61.468000000000004
A16: 11 | C16: DOM | D16: Shirlie calderon | E16: 61.341000000000001
A17: 12 | C17: DOM | D17: Michelle Roques | E17: 61.264000000000003
A18: 13 | C18: AHO | D18: Ivanna Harreman | E18: 60.661999999999999
A19: =A18+1 -> 14 | C19: DOM | D19: Ana Gabriella Vilchez | E19: 60.628999999999998
A20: =A19+1 -> 15 | C20: ARU | D20: Nikita Pablo | E20: 59.914999999999999
A21: =A20+1 -> 16 | C21: JAM | D21: Michelle-Ann Gabadon | E21: 59.330
A22: =A21+1 -> 17 | C22: ARU | D22: Jitva Sarman | E22: 59.210
A23: =A22+1 -> 18 | C23: AHO | D23: Joleanna Rodriguez | E23: 59.100
A24: =A23+1 -> 19 | C24: ARU | D24: Nathifa Sarman | E24: 58.862000000000002
A25: =A24+1 -> 20 | C25: JAM | D25: Shannon March | E25: 58.593000000000004
A26: =A25+1 -> 21 | C26: ARU | D26: Nathania Taylor | E26: 57.563000000000002
A27: =A26+1 -> 22 | C27: JAM | D27: Jessica Lim Sang | E27: 56.781999999999996
A28: =A27+1 -> 23 | C28: JAM | D28: Ashlei Gayle | E28: 55.460
A29: =A28+1 -> 24 | C29: JAM | D29: Tashna Smith-Edwards | E29: 52.774999999999999