I1: CISC 2008 Kingston, Jamaica Final Result Synchronized Swimming
E4: 12 & Under | L4: 13-15 | U4: 16-18
C5: FIGURES | E5: SOLO | G5: DUET | I5: TEAM | K5: TOTAL | L5: FIGURES | N5: SOLO | P5: DUET | R5: TEAM | T5: TOTAL | U5: FIGURES | W5: SOLO | Y5: DUET | AA5: TOTAL
C6: Place | D6: Points | E6: Place | F6: Points | G6: Place | H6: Points | I6: Place | J6: Points | L6: Place | M6: Points | N6: Place | O6: Points | P6: Place | Q6: Points | R6: Place | S6: Points | U6: Place | V6: Points | W6: Place | X6: Points | Y6: Place | Z6: Points
A7: 1 | B7: ARU | C7: 1,2,4,6,7,8 | D7: =24+22+18+14+12+10 -> 100 | E7: 1 | F7: 24 | G7: 1 | H7: 36 | I7: 1 | J7: 72 | K7: =SUM(D7+F7+H7+J7) -> 232 | L7: 2,4,5,8 | M7: =22+18+16+10 -> 66 | N7: 2 | O7: 22 | P7: 1 | Q7: 36 | R7: 1 | S7: 72 | T7: =M7+O7+Q7+S7 -> 196 | U7: 1,4,6 | V7: =24+18+14 -> 56 | W7: 1 | X7: 24 | Y7: 1 | Z7: 36 | AA7: =V7+X7+Z7 -> 116 | AB7: =+AA7+T7+K7 -> 544
B8: Aruba
A9: 2 | B9: AHO | C9: 5 | D9: 16 | E9: 2 | F9: 22 | G9: 2 | H9: 33 | K9: =SUM(D9+F9+H9+J9) -> 71 | N9: 5 | O9: 16 | P9: 4 | Q9: 27 | T9: =M9+O9+Q9+S9 -> 43 | U9: 7,8 | V9: =12+10 -> 22 | W9: 3 | X9: 20 | Y9: 3 | Z9: 30 | AA9: =V9+X9+Z9 -> 72 | AB9: =+AA9+T9+K9 -> 186
B10: Netherland Antilles
A11: 3 | B11: CUB | K11: =SUM(D11+F11+H11+J11) -> 0 | L11: 1 | M11: 24 | N11: 1 | O11: 24 | T11: =M11+O11+Q11+S11 -> 48 | AA11: =Z11+X11+V11 -> 0 | AB11: =+AA11+T11+K11 -> 48
B12: Cuba
A13: 4 | B13: DOM | C13: 3 | D13: 20 | E13: 3 | F13: 20 | K13: =SUM(D13+F13+H13+J13) -> 40 | L13: 3,6,7 | M13: =20+14+12 -> 46 | N13: 3 | O13: 20 | P13: 2 | Q13: 33 | R13: 2 | S13: 66 | T13: =M13+O13+Q13+S13 -> 165 | U13: 2,3,5, | V13: =22+20+16 -> 58 | W13: 2 | X13: 22 | Y13: 2 | Z13: 33 | AA13: =V13+X13+Z13 -> 113 | AB13: =+AA13+T13+K13 -> 318
B14: Dominican Rep.
A15: 5 | B15: JAM | E15: 4 | F15: 18 | G15: 3 | H15: 30 | I15: 2 | J15: 66 | K15: =SUM(D15+F15+H15+J15) -> 114 | N15: 4 | O15: 18 | P15: 3 | Q15: 30 | R15: 3 | S15: 60 | T15: =M15+O15+Q15+S15 -> 108 | AB15: =+AA15+T15+K15 -> 222
B16: Jamaica