D1: CISC 2008 Kingston, Jamaica Final Result Synchronized Swimming
D3: 12 & Under
D4: FIGURES
A5: Place | D5: Swimmer
A6: 1 | C6: ARU | D6: Kyra Hoevertsz | E6: 57.816000000000003
A7: 2 | C7: ARU | D7: Femke Rutgers | E7: 55.832999999999998
A8: 3 | C8: DOM | D8: Laura cardenas | E8: 54.595999999999997
A9: 4 | C9: ARU | D9: Etlyn Winterdaal | E9: 54.387
A10: 5 | C10: AHO | D10: Shelby Kasse | E10: 54.345999999999997
A11: 6 | C11: ARU | D11: Ariadne De Goeij | E11: 53.588000000000001
A12: 7 | C12: ARU | D12: Neftaly Albertsz | E12: 52.924999999999997
A13: 8 | C13: ARU | D13: Nataly Geerman | E13: 52.920999999999999
A14: 9 | C14: ARU | D14: Nakalee Dider | E14: 52.837000000000003
A15: 10 | C15: AHO | D15: Mikayla Huizer | E15: 52.661999999999999
A16: 11 | C16: ARU | D16: Alexandra Mendoza | E16: 52.517000000000003
A17: 12 | C17: JAM | D17: Jamielya Shaw | E17: 44.308
A18: 13 | C18: JAM | D18: Aexandria Hinds | E18: 37.978000000000002
A19: =A18+1 -> 14 | C19: JAM | D19: Breann Campbell | E19: 36.834000000000003
A20: =A19+1 -> 15 | C20: JAM | D20: Deanna Webber | E20: 35.442999999999998
A21: =A20+1 -> 16 | C21: JAM | D21: Jada Brown | E21: 35.378
A22: =A21+1 -> 17 | C22: JAM | D22: Laura Lim Saang | E22: 35.061999999999998
A23: =A22+1 -> 18 | C23: JAM | D23: Chelsea Goffe | E23: 33.970