A1: CARIBBEAN ISLANDS SWIMMING CHAMPIONSHIPS
A2: KINGSTON, JAMAICA
A3: JULY 17 - 22, 2008
A5: WATERPOLO COMPETITION
C9: GAMES PLAYED | D9: GAMES WON | E9: GAMES LOSS | F9: GAMES DRAWN | G9: FINAL POSITION | H9: FINAL POINTS
A12: FEMALE | B12: Jamaica | C12: 3 | D12: 3 | E12: 0 | F12: 0 | G12: Gold | H12: 18
A13: 15 & Under | B13: Puerto Rico | C13: 3 | D13: 0 | E13: 3 | F13: 0 | G13: Silver | H13: 14
A18: FEMALE | B18: Netherlands Antilles | C18: 3 | D18: 0 | E18: 3 | F18: 0 | G18: Silver | H18: 14
A19: 17 & Under | B19: Trinidad & Tobago | C19: 3 | D19: 3 | E19: 0 | F19: 0 | G19: Gold | H19: 18
A24: MALE | B24: Jamaica | C24: 3 | D24: 0 | E24: 3 | F24: 0 | G24: Silver | H24: 14
A25: 15 & Under | B25: Trinidad & Tobago | C25: 3 | D25: 3 | E25: 0 | F25: 0 | G25: Gold | H25: 18
A30: MALE | B30: Dominican Republic | C30: 3 | D30: 2 | E30: 0 | F30: 1 | G30: Gold | H30: 18
A31: 17 & Under | B31: Jamaica | C31: 3 | D31: 0 | E31: 3 | F31: 0 | G31: 4th | H31: 10
B32: Puerto Rico | C32: 3 | D32: 1 | E32: 2 | F32: 0 | G32: Bronze | H32: 12
B33: Trinidad & Tobago | C33: 3 | D33: 2 | E33: 0 | F33: 1 | G33: Silver | H33: 14
A38: MALE | B38: Bahamas | C38: 3 | D38: 0 | E38: 3 | F38: 0 | G38: 4th | H38: 10
A39: 18 & Over | B39: Barbados | C39: 3 | D39: 1 | E39: 2 | F39: 0 | G39: Bronze | H39: 12
B40: Jamaica | C40: 3 | D40: 2 | E40: 1 | F40: 0 | G40: Gold | H40: 18
B41: Trinidad & Tobago | C41: 3 | D41: 3 | E41: 0 | F41: 0 | G41: Silver | H41: 14
F45: TOTAL POINTS
A46: OVERALL | B46: Bahamas | F46: =+H38 -> 10 | H46: 7th
A47: POINTS | B47: Barbados | F47: =+H39 -> 12 | H47: 6th
B48: Dominican Republic | F48: =+H30 -> 18 | H48: 4th
B49: Jamaica | F49: =+H40+H31+H24+H12 -> 60 | H49: 2nd
B50: Netherlands Antilles | F50: =+H18 -> 14 | H50: 5th
B51: Puerto Rico | F51: =+H32+H13 -> 26 | H51: 3rd
B52: Trinidad & Tobago | F52: =+H41+H33+H25+H19 -> 64 | H52: 1st